{
  "name": "ops-core-next-ai-proposed",
  "goal": "Advance FloorConnector operational continuity across Project Workspace, CrewBoard field handoff, and customer-safe portal trust without schema changes.",
  "rationale": "Template fallback selected high-value operational strides from current docs and wave context while preserving canonical records and human approval.",
  "base": "origin/main",
  "worktreeRoot": "C:/FC-worktrees",
  "maxConcurrency": 2,
  "productStrideCriteria": [
    "Improves daily contractor operations",
    "Connects to canonical workflow records",
    "Reduces manual decision friction",
    "Creates visible user-facing capability",
    "Avoids duplicate models and module silos"
  ],
  "mainValidation": [
    "pnpm.cmd --filter @floorconnector/web typecheck",
    "pnpm.cmd --filter @floorconnector/web lint",
    "pnpm.cmd fc:preflight:fast",
    "git diff --check"
  ],
  "streams": [
    {
      "name": "project-readiness-stride-v1",
      "branch": "stream/project-readiness-stride-v1",
      "worktree": "C:/FC-worktrees/project-readiness-stride",
      "promptFile": ".codex/waves/ops-core-next-ai-proposed/prompts/project-readiness-stride-v1.md",
      "risk": "medium",
      "productOutcome": "Tighten Project Workspace readiness and next-action continuity over existing project, estimate, contract, job, invoice, and payment records.",
      "whyThisMatters": "Project remains the operating hub, and clearer readiness makes the existing canonical loop easier to act on without adding new models.",
      "dependsOn": [],
      "expectedFiles": [
        "apps/web/app/(app)/projects",
        "apps/web/lib/projects",
        "docs/current-state.md"
      ],
      "validation": [
        "pnpm.cmd --filter @floorconnector/web typecheck",
        "pnpm.cmd --filter @floorconnector/web lint",
        "pnpm.cmd fc:preflight:fast",
        "git diff --check"
      ],
      "acceptanceCriteria": [
        "Project-facing changes use existing canonical records and read models.",
        "No schema, auth, RLS, payment math, provider, or route-protection changes are made.",
        "Users can identify the next safe operational action more quickly."
      ],
      "boundaries": [
        "Do not create a project activity table or duplicate project state.",
        "Do not mutate source records from read-model surfaces.",
        "Do not expose portal-only or contractor-only data incorrectly."
      ],
      "promptBody": "# Chat: Project Readiness Stride V1\n\nBranch: `stream/project-readiness-stride-v1`\nWorktree: `C:\\FC-worktrees\\project-readiness-stride`\n\n## Goal\n\nTighten Project Workspace readiness and next-action continuity over existing project, estimate, contract, job, invoice, and payment records.\n\n## Required Docs\n\nRead these before implementation:\n\n- `docs/developer-source-of-truth.md`\n- `docs/current-state.md`\n- `docs/workflows.md`\n- `docs/chat-handoff.md`\n- `docs/system-overview.md`\n- `.codex/worktree-rules.md`\n- `.codex/active-stream-plan.md`\n\n## Boundaries\n\n- Do not create a project activity table or duplicate project state.\n- Do not mutate source records from read-model surfaces.\n- Do not expose portal-only or contractor-only data incorrectly.\n- Do not change schema, migrations, Supabase policies, RLS, auth, env vars, route protection, payment math, provider behavior, or unrelated business logic.\n- Do not create duplicate business models or portal-owned operational state.\n\n## Implementation Requirements\n\n- Start by checking `git status --short --branch`, current branch, and ahead/behind state.\n- Run `git fetch origin`.\n- Avoid staging unrelated changes.\n- Preserve existing repo conventions and canonical records.\n- Keep the slice bounded to the named product outcome.\n- Update docs only if implemented behavior changes.\n\n## Acceptance Criteria\n\n- Project-facing changes use existing canonical records and read models.\n- No schema, auth, RLS, payment math, provider, or route-protection changes are made.\n- Users can identify the next safe operational action more quickly.\n\n## Validation\n\nRun:\n\n```powershell\npnpm.cmd --filter @floorconnector/web typecheck\npnpm.cmd --filter @floorconnector/web lint\npnpm.cmd fc:preflight:fast\ngit diff --check\n```\n\n## Git Completion Requirements\n\n- Stage only intended files.\n- Commit the completed slice.\n- Do not push unless asked.\n\n## Final Response Requirements\n\nReport branch, starting status, final status, commit hash/message, files changed, validation results, skipped checks, limitations, assumptions, and follow-up dependencies."
    },
    {
      "name": "crewboard-field-handoff-stride-v1",
      "branch": "stream/crewboard-field-handoff-stride-v1",
      "worktree": "C:/FC-worktrees/crewboard-field-handoff-stride",
      "promptFile": ".codex/waves/ops-core-next-ai-proposed/prompts/crewboard-field-handoff-stride-v1.md",
      "risk": "medium",
      "productOutcome": "Improve CrewBoard to field execution handoff clarity using canonical jobs, job assignments, daily logs, field notes, and project context.",
      "whyThisMatters": "The schedule-to-field boundary is where operations become real work, and it should be clear without creating a dispatch or field silo.",
      "dependsOn": [],
      "expectedFiles": [
        "apps/web/app/(app)/schedule",
        "apps/web/lib/schedule",
        "docs/current-state.md"
      ],
      "validation": [
        "pnpm.cmd --filter @floorconnector/web typecheck",
        "pnpm.cmd --filter @floorconnector/web lint",
        "pnpm.cmd fc:preflight:fast",
        "git diff --check"
      ],
      "acceptanceCriteria": [
        "CrewBoard handoff remains advisory/read-only unless using existing actions.",
        "Daily Log and Job links route to canonical records.",
        "No new schedule, dispatch, or field task model is introduced."
      ],
      "boundaries": [
        "Do not add route optimization, automated scheduling, or dispatch tables.",
        "Do not bypass Ready Check or project readiness gates.",
        "Do not expose field internals to portal users."
      ],
      "promptBody": "# Chat: Crewboard Field Handoff Stride V1\n\nBranch: `stream/crewboard-field-handoff-stride-v1`\nWorktree: `C:\\FC-worktrees\\crewboard-field-handoff-stride`\n\n## Goal\n\nImprove CrewBoard to field execution handoff clarity using canonical jobs, job assignments, daily logs, field notes, and project context.\n\n## Required Docs\n\nRead these before implementation:\n\n- `docs/developer-source-of-truth.md`\n- `docs/current-state.md`\n- `docs/workflows.md`\n- `docs/chat-handoff.md`\n- `docs/system-overview.md`\n- `.codex/worktree-rules.md`\n- `.codex/active-stream-plan.md`\n\n## Boundaries\n\n- Do not add route optimization, automated scheduling, or dispatch tables.\n- Do not bypass Ready Check or project readiness gates.\n- Do not expose field internals to portal users.\n- Do not change schema, migrations, Supabase policies, RLS, auth, env vars, route protection, payment math, provider behavior, or unrelated business logic.\n- Do not create duplicate business models or portal-owned operational state.\n\n## Implementation Requirements\n\n- Start by checking `git status --short --branch`, current branch, and ahead/behind state.\n- Run `git fetch origin`.\n- Avoid staging unrelated changes.\n- Preserve existing repo conventions and canonical records.\n- Keep the slice bounded to the named product outcome.\n- Update docs only if implemented behavior changes.\n\n## Acceptance Criteria\n\n- CrewBoard handoff remains advisory/read-only unless using existing actions.\n- Daily Log and Job links route to canonical records.\n- No new schedule, dispatch, or field task model is introduced.\n\n## Validation\n\nRun:\n\n```powershell\npnpm.cmd --filter @floorconnector/web typecheck\npnpm.cmd --filter @floorconnector/web lint\npnpm.cmd fc:preflight:fast\ngit diff --check\n```\n\n## Git Completion Requirements\n\n- Stage only intended files.\n- Commit the completed slice.\n- Do not push unless asked.\n\n## Final Response Requirements\n\nReport branch, starting status, final status, commit hash/message, files changed, validation results, skipped checks, limitations, assumptions, and follow-up dependencies."
    },
    {
      "name": "portal-operational-trust-stride-v1",
      "branch": "stream/portal-operational-trust-stride-v1",
      "worktree": "C:/FC-worktrees/portal-operational-trust-stride",
      "promptFile": ".codex/waves/ops-core-next-ai-proposed/prompts/portal-operational-trust-stride-v1.md",
      "risk": "medium",
      "productOutcome": "Clarify customer-safe portal continuity across project, contract, invoice, payment, and shared document review paths.",
      "whyThisMatters": "The portal should reinforce the same shared operational loop without leaking contractor-only state or creating portal-owned truth.",
      "dependsOn": [],
      "expectedFiles": [
        "apps/web/app/portal",
        "apps/web/lib/portal",
        "docs/current-state.md"
      ],
      "validation": [
        "pnpm.cmd --filter @floorconnector/web typecheck",
        "pnpm.cmd --filter @floorconnector/web lint",
        "pnpm.cmd fc:preflight:fast",
        "git diff --check"
      ],
      "acceptanceCriteria": [
        "Portal copy remains customer-safe and scoped by existing access checks.",
        "Customer actions route to canonical estimate, contract, invoice, and payment records.",
        "No portal-owned copies or access-rule changes are introduced."
      ],
      "boundaries": [
        "Do not change portal grants, RLS, auth, or route protection.",
        "Do not expose internal blockers, Job Notes, provider diagnostics, or contractor-only evidence.",
        "Do not create portal-specific business records."
      ],